url,title,content
https://www.is.vnu.edu.vn/ts-chu-dinh-toi/,TS.Chu Đình TớiTrưởng KhoaTrường Quốc tế - ĐHQG Hà Nội,"Home » TS.Chu Đình Tới
TS. Chu Đình Tới
Chức vụ: Giảng viên chính, Trưởng Khoa, Khoa Các khoa học ứng dụng, Giám đốc Trung tâm Y sinh và Sức khoẻ cộng đồng
Học hàm, học vị: Tiến sĩ Y học
Ngoại ngữ: Tiếng Anh
Email: t oicd@vnuis.edu.vn
Địa chỉ: Trường Quốc tế – ĐHQGHN, nhà G7, 144 Xuân Thủy, Cầu Giấy, Hà Nội
Cử nhân: Bác sĩ Thú Y, Học viện Nông nghiệp Việt Nam
Thạc sĩ: Sinh học (Miễn dịch học), Trường ĐH Ulsan, Hàn Quốc
Tiến sĩ: Y học (Y sinh), Đại học Y Bialstock, Ba Lan
Postdoc: Y học phân tử, Đại học Oslo, Nauy
Hướng nghiên cứu
Tế bào gốc trong điều trị, mỹ phẩm và dược phẩm
Y sinh học phân tử (miễn dịch học, di truyền y học và dịch tễ học phân tử)
Dinh dưỡng thực phẩm
Sức khỏe môi trường và sức khoẻ cộng động
Các môn giảng dạy
Miễn dịch học
Sinh lý học người và động vật
Y sinh học phân tử đại cương
Tế bào gốc
Mapping child growth failure across low- and middle-income countries. Dinh Toi Chu and other Local Burden of Disease Child Growth Failure Collaborators. Nature. 2020 Jan; 577(7789):231-234. SCI, Q1, IF (2018): 43.070
The global burden of childhood and adolescent cancer in 2017: an analysis of the Global Burden of Disease Study 2017. Dinh Toi Chu and other GBD 2017 Childhood Cancer Collaborators. The Lancet Oncology, 2019. S1470-2045(19)30339-0, IF (2017): 33.831
Global, Regional, and National Cancer Incidence, Mortality, Years of Life Lost, Years Lived With Disability, and Disability-Adjusted Life-Years for 29 Cancer Groups, 1990 to 2017 A Systematic Analysis for the Global Burden of Disease Study. Dinh Toi Chu and other Global Burden of Disease Cancer Collaborators. JAMA Oncology, 2019 Sep 27. doi: 10.1001/jamaoncol.2019.2996. SCI, Q1, IF (2017): 22.416
OPA1-anchored PKA phosphorylates perilipin on S522 and S497 to activate ATGL and HSL in human adipose stem cells. Marie Rogne, Dinh Toi Chu, Thomas M Küntziger, Maria-Niki Mylonakou, Philippe Collas, and Kjetil Tasken. Molecular Biology of the Cell, 2019 29(12): 1487–1501 (IF= 4.803). Link: https://www.molbiolcell.org/doi/pdf/10.1091/mbc.E17-09-0538
Brown and brite adipocytes: same function, but different origin and response. Dinh-Toi Chu*, Barbara Gawronska-Kozak*. Biochimie 2017 138:102-105 (IF= 3.017)
Molecular connections of obesity and aging: a focus on adipose protein 53 and retinoblastoma protein. Dinh-Toi Chu*, Yang Tao. Biogerontology, 2017 18(3):321-332  (IF=3.252) (*Tác giả liên hệ và tác giả thứ nhất) (ĐT EU1) SCIE Q1. Link: https://link.springer.com/article/10.1007%2Fs10522-017-9698-4
Mest and Sfrp5 are biomarkers for healthy adipose tissue. Magdalena Jura, MS; Julia Jaroslawska, PhD; Dinh-Toi Chu, PhD; Leslie Paul Kozak, Ph.D. Biochimie, 2016 124:124-133 (IF=3.017)
C57BL/6J mice as a polygenic developmental model of diet-induced obesity. Dinh-Toi Chu*, Malinowska E, Magdalena Jura, Kozak LP. Physiological Reports,  2016 5(7). pii: e13093. doi: 10.14814/phy2.13093.
Expression of Adipocyte Biomarkers in a Primary Cell Culture Models Reflects Preweaning Adipobiology. Chu Dinh-Toi*, Malinowska E, Gawronska-Kozak B, Kozak LP. J. Biol. Chem, 289(26): 2014 18478-88 (IF=4.57)
2008. Văn Lệ Hằng, Đào Đức Thà, Chu Đình Tới. Sinh Sản Vật Nuôi. Nhà Xuất Bản Giáo Dục. Năm 2008.
2008. Nguyễn Bá Hiên, Nguyễn Quốc Doanh, Phạm Sỹ Lăng, Nguyễn Thị Kim Thành, Chu Đình Tới. Vi sinh vật và Bệnh truyền nhiễm vật nuôi. Nhà Xuất Bản Giáo Dục. Năm 2008
2009. Phạm Ngọc Thạch, Dương Thị Anh Đào, Phạm Khắc Hiếu, Nguyễn Thị Kim Thành, Chu Đức Thắng và Chu Đình Tới. Chẩn đoán bệnh và bệnh nội khoa thú y. Nhà Xuất Bản Giáo Dục. Năm 2009
2010. Phạm Sỹ Lăng, Nguyễn Thị Kim Lan, Nguyễn Thị Kim Thành, Nguyễn Văn Thọ, và Chu Đình Tới. Ký sinh trùng và Bệnh ký sinh trùng ở vật nuôi. Nhà Xuất Bản Giáo Dục. Năm 2010
2013. Văn Lệ Hằng, Chu Đình Tới. Bệnh học động vật. Nhà Xuất Bản Sư Phạm. Năm 2013.
2015. Chu Đình Tới. Hành trang du học. Nhà xuất bản Lao Động. Năm 2015. Link. https://tiki.vn/hanh-trang-du-hoc-p452809.html?src=brand-page
2016. Chu Đình Tới. Tôi đã đi du học bằng học bổng như thế. NXB Dân Trí 5.2016. link: https://tiki.vn/toi-da-di-du-hoc-bang-hoc-bong-nhu-the-nao-p524479.html?src=bestseller-page
2017. Chu Đình Tới. Cẩm Nang Học Tập Và Làm Việc Ở Nước Ngoài. NXB Lao Động, 11.2017. link: https://tiki.vn/cam-nang-hoc-tap-va-lam-viec-o-nuoc-ngoai-p892677.html?src=brand-page
2018. Tản Viên (Bút danh của Chu Đình Tới). Chuyện tình Kim Chi – Nói yêu em giữa Ulsan lộng gió. Nhà xuất bản Thanh niên năm 2018. link: https://www.fahasa.com/chuyen-tinh-kim-chi-noi-yeu-em-giua-ulsan-long-gio.html?attempt=2
NAFOSTED (No. 106.02-2019.314). Studying the expression and variation of some important biomarkers on mouse adipose tissues, 4/2020-4/2023
Nanjing Agricultural University (Grant number: 2018-AH-04) International Cooperation Seeds Funding of Nanjing Agricultural University, 10/2018-10/2019
NAFOSTED (No. 106.02-2019.41). Building a platform for engineering highly active antimicrobial peptides based on molecular dynamics simulation of the peptide-membrane interaction, Member, 04/2019-04/2021
Hanoi City, Vietnam (No. 5428 / QD-UBND). Building a system of support for diagnosis, dental disease diagnosis based on mobile devices and applications at a number of medical examination and treatment facilities in Hanoi City, 2018-2020
European Union and University of Oslo. Roles of AKAP proteins in adipocytes’ functions. 11/2015-11/2018
European Union via the Foundation for Polish Science. Nutrition and ambient temperature during early development can reduce susceptibility to obesity, 12/2010-10/2015
Từ 01/3/2021 : Giảng viên chính, Giám đốc Trung tâm Y sinh và Sức khoẻ Cộng đồng, Khoa Quốc tế, Đại học Quốc gia Hà Nội
Từ 06/2008-2/2021 : Giảng viên, rồi Giảng viên chính, Trường Đại học Sư phạm Hà Nội
T ừ 2015-2017 : Nghiên cứu sau tiến sĩ (Marie Curie Postdoc) tại Trung tâm Y học phân tử, Khoa Y học, Trường Đại học Oslo (Na Uy)
Từ 2017-2018 : Nghiên cứu viên tại Trung tâm Y học phân tử, Khoa Y học, Trường Đại học Oslo (Na Uy)
Từ 2006-2008 : Giảng viên thử việc, Trường Đại học Sư phạm Hà Nội
Tìm kiếm
ĐỊA CHỈ
Trường Quốc tế, Đại học Quốc gia Hà Nội
Cơ sở Xuân Thuỷ:
Nhà E5 & G7, 144 Xuân Thủy, Cầu Giấy, Hà Nội
Cơ sở Phan Tây Nhạc:
Số 1, Phố Phan Tây Nhạc, Xuân Phương, Hà Nội
Cơ sở Hoà Lạc:
Toà nhà HT1, Khu Đô thị đại học, Đại học Quốc gia Hà Nội tại Hoà Lạc, Hà Nội
Điện thoại: 024.3557.5992
Email: is@vnu.edu.vn
Bản đồ chỉ dẫn
Thông tin
Đại học Quốc gia Hà Nội
Các phòng chức năng
Các khoa trực thuộc
Các trung tâm, viện
Sơ đồ website
Xem sơ đồ trang
Liên hệ
Bản quyền © 2022 thuộc về Trường Quốc tế - ĐHQGHN
https://www.is.vnu.edu.vn"
https://www.is.vnu.edu.vn/ts-ha-manh-hung/,TS. Hà Mạnh HùngTrường Quốc tế - ĐHQG Hà Nội,"Home » TS. Hà Mạnh Hùng
TS. Hà Mạnh Hùng
Chức vụ: Giảng viên
Học hàm, học vị: Tiến sĩ
Ngoại ngữ: Tiếng Anh
Email: hunghm@vnuis.edu.vn
Địa chỉ: Trường Quốc tế – ĐHQGHN, nhà G7, 144 Xuân Thủy, Cầu Giấy, Hà Nội
Kỹ sư: Công Nghệ Thông Tin, ICTU, Việt Nam
Thạc sĩ : Công Nghệ Thông Tin, ĐH Paris 13, Pháp
Tiến sĩ: Kỹ thuật Điện (Thị giác máy tính và Robot), ĐH Quốc Gia CCU, Đài Loan
Hướng nghiên cứu
Phân tích Ảnh và Video
Nhận dạng hành động  theo không gian-thời gian
Nhận dạng sự kiện
Phân tích hành vi
2D3D phát hiện đối tượng
Truy vết đa đối tượng
Nhận dạng mẫu
Trí tuệ nhân tạo, học máy, và dữ liệu thay thế
Hệ thống thời gian thực.
Các môn học giảng dạy
Nhập môn CNTT ứng dụng
Cấu trúc dữ liệu và giải thuật
Kĩ thuật lập trình
Thiết kế hệ thống thông tin
Trí tuệ nhân tạo
Khai phá dữ liệu
Khai phá dữ liệu & phân tích kinh doanh
Lập trình Python
Học máy
Học Sâu.
Manh-Hung Ha* , Chen, O. T.-C. “Rectified Attention Gate Unit in Recurrent Neural Networks for Effective Attention Computation,” In IEEE Statistical Signal Processing (SSP),
Manh-Tuan Do, Manh-Hung Ha* , Duc-Chinh Nguyen, Kim Thai and Quang-Huy Do, “Human Detection Based Yolo Backbones-Transformer in UAVs,” In Procceding of International Conference on System Science and Engineering, 2023.
Manh-Hung Ha , Anh-Luyen Do, Oscal Tzyh-Chiang Chen, Cong-Doan Truong and Van-Tinh Nguyen “NDAU: Non-Local Dual Attention-Gated Unet for Brain Tumor Segmentation,” In Procceding of International Conference on System Science and Engineering, 2023.
Dang, S.T. Dinh, X.M. Kim, T.D. Xuan, H.L. Manh-Hung Ha . “Adaptive Backstepping Hierarchical Sliding Mode Control for 3-Wheeled Mobile Robots Based on RBF Neural Networks”. Electronics 2023, 12, 2345(SCIE, Q2) https://doi.org/10.3390/electronics12112345
Manh-Hung Ha , Pham, T. A., Thanh, D. T. & Luan, T. V. Attention correlated appearance and motion feature followed temporal learning for activity recognition (SCIE, Q2). International Journal of Electrical and Computer Engineering (IJECE), 2023
Binh Le, Thai Kim, Manh-Hung Ha and Anh Tran, “Robust Surgical Tool Detection in Laparoscopic Surgery Using YOLOv8 Model”, International conference on system science and engineering (ICSSE), 2023
Manh-Hung Ha , Chen, O. T.-C. “Non-local based correlation spatial temporal feature for action recognition,” In IEEE international conference on multimedia and expo (ICME) , Rank-A, Taiwan, 2022
Manh-Hung Ha , Minh-Huy Le, Khoa Nguyen Dang, Dinh-Thai Kim, Van Luan Tran. “Action Recognition of Traffic Police by Attentive for Self-Driving Vehicles,” International Conference on Advanced Technologies for Communications (ATC), 2022
Van Luan Tran, Huei-Yung Lin, and Manh-Hung Ha , “Semantic vehicle segmentation from aerial images using deep learning,” International Conference on Advanced Technology and Sustainable Development (ICATSD), 2022
Tran Thi Van; Nguyen Dang Khoa; Ha Manh Hung ; Pham Duy Duong; Le Minh Huy; Pham Duc Dai, “A framework for simulation and testing of UAVs structure and algorithms,” The International scientific conference on Applying new Technology in Green Buildings (ATiGB), 2022
Manh-Hung Ha , Tran Mach Tuan Kiet, Kim Dinh Thai, Le Xuan Hai, Pham Ngoc Thanh, “Convolutional Neural Network Based Attentive Model for Vehicle License Plate Identification”, International Conference on Human-centered Artificial Intelligence, 2022
Anh Tran, Thai Kim, Manh-Hung Ha , Hai Le, Thanh Pham and Linh Nguyen, “Deep Neural network for Surgical-tools Detection in minimally invasive surgery,” International Conference on Human-centered Artificial Intelligence, 2022
Nguyễn Văn Thiện, Đỗ Mạnh Tuấn, Kim Đình Thái, Lê Xuân Hải, Hà Mạnh Hùng , Phạm Ngọc Thành, Nguyễn Lê Hoàng, Đặng Hải Bình, “Phát hiện trang bị bảo hộ lao động cá nhân trong các công trường xây dựng dựa trên mạng nơ-ron học sâu YOLOv7,” In the 25th vietnam conference of selected ict problems, Vietnam
Manh-Hung Ha , Chen, O. T.-C. “Deep neural networks using residual fast-slow refined highway and global atomic spatial attention for action recognition and detection,” IEEE Access, doi: 10.1109/ACCESS.2021.3134694, 9, 164887–164902(SCI, EI, Q1-R1)
Manh-Hung Ha , and Oscal. T.-C. Chen, “Deep Neural Networks Using Capsule Networks and Skeleton-Based Attentions for Action Recognition,” IEEE Access, vol. 9, pp. 6164-6178, 2021. (SCI, EI, Q1).
Manh-Hung Ha , and Oscal. T.-C. Chen, “Action recognition improved by correlations and attention of subjects and scene” IEEE International Conference on Visual Communications and Image Processing (VCIP, Rank_B), Germany, 2021
Manh-Hung Ha , Oanh, N. T. & Anh, P. T. (2021). Exploration of temporal network topologies in a recurrent neural network for activity recognition, In the 24th vietnam conference of selected ict problems (VNICT2021), Vietnam
Manh-Hung Ha , Pham, T.-A., Nguyen, V.-T. & Nong, V.-H. (2021). Mô hình học sâu nâng cao ứng dụng cho xe tự hành phát hiện đối tượng và nhận dạng hành động điều khiển của cảnh sát giao thông, In national conference on electronics, communications and information technology (REV-ECIT), Vietnam
Manh-Hung Ha & Chen, O. T.-C. Traffic police action recognition by local-global feature-based attention, In IEEE international conference on science, education, and viable engineering (ICSEVEN), Taiwan, 2021
T.-C. Chen, Manh-Hung Ha , and Y. L. Lee, “Computation-affordable recognition system for activity identification using a smart phone at home,” in Proceedings of the IEEE International Symposium on Circuits and Systems, Rank-A, pp. 1-5, Italy, 2020
Manh-Hung Ha (Invited Talk). Evaluation of tracking and recognition of multiple subjects for homecare. Yunlin University, Taiwan, seminar at the Workshop, 2019.
T.-C. Chen, Manh-Hung Ha , and W.-C. Lai, “Activity recognition of multiple subjects for homecare,” in Proceedings of the 10th International Conference on Knowledge and Smart Technology, pp. 242–247, Thailan, 2018.
T.-C. Chen, C.-H. Tsai, Manh-Hung Ha , and W.-C. Lai, “Activity recognition using a panoramic camera for homecare.” in Proceedings of 14th IEEE International Conference on Advanced Video and Signal Based Surveillance, Rank_B, pp. 1-6, Italy, 2017.
Ha Manh Hung , N. H. M. “Improved Efficiency of CBIR Using Contourlet Transform,” TNU Journal of Science and Technology, VietNam, 43, 45–51, 2016.
Nghiên Cứu Khai Phá Dữ Liệu Web và Ứng Dụng Tìm Kiếm Trích Chọn Thông Tin Chủ Đề, Đại học Thái Nguyên (2015-2016)
Nhận Dạng Hành Động Cảnh Sát Điều Khiển Giao Thông, Viện Nghiên Cứu Chiến Lược Giao Thông Đô Thị Đài Loan (05/2020-05/202)
Nhận Dạng Đa Hành Động tiếp cận học sâu nâng cao, Bộ Giáo Dục Đài Loan (05/2021-07/2021).
Nhận dạng hành động bất thường cho người già trong hệ thống chăm sóc gia đình, Viện Công Nghiệp Đổi Mới Sáng Tạo Đài Loan (10/2016-10/2020)
Phân Tích Hành Động Trong HomeCare, Bộ Khoa Học Công Nghệ Đài Loan (10/2017-10/2020)
Quá trình công tác
Từ 09/2009-06/2021: Giảng viên, Đại học Công nghệ Thông tin và Truyền thông, Đại học Thái Nguyên.
Từ 2021-2022: Giảng viên thỉnh giảng, Nghiên cứu viên tại Đại học FPT.
Từ 2021-07/2022: Giảng viên, Nghiên cứu viên tại Đại học Phenikaa.
Từ 2024-2029: Giáo sư thỉnh giảng tại Đại học KL, Ấn Độ
Từ 15/07/2022-Nay: Giảng viên, nghiên cứu viên tại Trường Quốc tế, Đại học Quốc gia Hà Nội.
Tìm kiếm
ĐỊA CHỈ
Trường Quốc tế, Đại học Quốc gia Hà Nội
Cơ sở Xuân Thuỷ:
Nhà E5 & G7, 144 Xuân Thủy, Cầu Giấy, Hà Nội
Cơ sở Phan Tây Nhạc:
Số 1, Phố Phan Tây Nhạc, Xuân Phương, Hà Nội
Cơ sở Hoà Lạc:
Toà nhà HT1, Khu Đô thị đại học, Đại học Quốc gia Hà Nội tại Hoà Lạc, Hà Nội
Điện thoại: 024.3557.5992
Email: is@vnu.edu.vn
Bản đồ chỉ dẫn
Thông tin
Đại học Quốc gia Hà Nội
Các phòng chức năng
Các khoa trực thuộc
Các trung tâm, viện
Sơ đồ website
Xem sơ đồ trang
Liên hệ
Bản quyền © 2022 thuộc về Trường Quốc tế - ĐHQGHN
https://www.is.vnu.edu.vn"
