url,title,content
https://www.is.vnu.edu.vn/tran-chi/,GS.TSKH. Trần ChiTrường Quốc tế - ĐHQG Hà Nội,"Home » GS.TSKH. Trần Chi
GS. TSKH. Trần Chi
Chức vụ: Cố vấn khoa học
Học hàm/ Học vị: GS.TSKH
Ngoại ngữ: Tiếng Anh
Email: tran.chi@uwm.edu.pl
Địa chỉ: Płocka 48/36; 01-152 Warsaw, BALAN
1987 Tiến sĩ, Đại học Bách Khoa Gdask, Ba Lan
1988-1998 Giáo Viên giảng dạy tại Trường Bách Khoa Gdańsk, Ba Lan
1998-1999 Thực tập khoa học tại trường đại học tổng hợp Padova, Ý
1998-2017 Thành viên hội cơ học Châu Âu
2000 Tiến sĩ khoa học, Đại học Bách Khoa Gdask, Ba Lan
2016 Giáo sư, giáo sư tiến sĩ khoa học
2018-2019 Giáo viên giảng dạy tại “Đại học Kinh tế và kĩ nghệ thông tin Châu Âu” ở Warsaw Balan.
Vật lý lượng tử
Trạng thái lượng tử
Ranh giới lượng tử
Đã công bố khoảng 100 công trình khoa học tại các nhà xuất bản khoa học như: springer, Scorpus, Symbiosis, Lupine (US)
Đã công bố nhiều công trình khoa học tại các hội nghị khoa học quốc tế quan trọng
Tran C. (2019) Quantum Intelligence , J. Current Trends in Computer Sciences & Applications, LUPINE Publishers, Office West 57th Street, New York – NY 10019 USA
Tran C. (2017) Artificial Brain and “Human-Machine” Integration , ‘Journal of Computer Science Applications and Information Technology’, Symbiosis group, Editorial Office: 1203, Heron Drive, Normal, Illinois-61761, USA
Tran C. (2016): The Internet of Thing and the Brain of Thing, on ResearchGate
Tran C. (2015): Structural-damage detection with big data using parallel computing based on MPSoC , International Journal of Machine Learning and Cybernetics ISSN 1868-8071 Int. J. Mach. & Cyber. DOI 10.1007/s13042-015-0453-3
Tran C. (2014): Cognitive information processing , Vietnam J Comput Sci (2014) 1:207–218 DOI 10.1007/s40595-014-0019-6. Tran C. (2013): Meta-concept and intelligent data processing in the geotechnical fields; Studies in Computational Intelligence of Springer-Verlag GmbH Berlin Heidelberg. Geotechnika PL ISSN 0867-4299, v. 6, 510-516.
Chi Tran, Determination of the shear speed of soil triaxial testing based on fuzzy logic, Computer Assisted Mechanics and Engineering Sciences (CAMES) V.15, No 2, str. 113-121, 2008 8. Tran C., Srokosz P.(2010): The Idea of PGA Stream Computations for Soil Slope Stability Evaluation; R. Mecanique Academie des sciences/Editions scientifiques et medicales Elsevier SAS, v. 338, 499-509.
Tran C. (2009) Fuzzy Control for Mechatronic Systems, Computer Assisted Mechanics and Engineering Sciences (CAMES); Polish Academy of Sciences 11-20.
Tran C. (2009) Meta-knowledge and “truth and falsehood” philosophy in the information processing of the human brain ; Part I: Theoretical Foundations. Artificial intelligence; Engineering Knowledge and Expert Systems; Pub. EXIT, Warsaw.
Tran C. (2008) Application of Information Technology (IT) in Geotechnics , Lectures (1, 2) in European course “Geotaco” program at Zilina University, Slovakia
Tran C. (2008) “ Structural Optimization in Truth Dimension ” , of C.R. Mecanique 330 Academic des Siences, Edition Sientifiques et medicales SAS, France.
Tran C. & Dembicki E. (1998) Intelligent System in Geotechnical Problems , Proc. „2nd International Conference on Environmental Management”, University Wollongong Australia.
Tran C. & Dembicki E. (1998) Determining Relative Density of Sands from CPT Using Fuzzy Measure theory , 4 th Proc. of Conf. On Numerical. Methods in Geo. Eng. Udine (Italy) October 98. 751-760
Dembicki E. & Tran C. (1998) Multicriteria Reliability-Based Structural Optimization . Proc. of Sym. On Reliability-Based Design in Civil Engineering, Lausane EPFL July 98.
Tran C., Dembicki E. (1998) Artificial intelligence in didactics . Scientific notebook of the Faculty of Electrical and Control Engineering in Gdańsk 12/98. s. 43-50. MNiSW
Tran C., Dembicki E. (1997) Optimization of the Block Foundations . Computer Assisted Mechanics and Engineering Sciences 4, pp. 243-255. MNiSW
Tran C., Dembicki E. (1997) Multivalued logic in the optimization of supporting structures. XI National Conference of Soil Mechanics and Foundations, Gdańsk. Tom. II s. 211-224;
Tran C. & Dembicki E. (1997). Nonmonotonic Logic for the Structural Design Problems in Geotechnical Engineering , Proc. „9th International Conference of the Association for Computer Methods and Advances in Geomechanics”, November 1997. Proc. Ninth Int. Conf. On Computer Methods and Advances in Geomechanics. Wuhan (China), pp. 461-466.
Tran C. & Dembicki E. (1997) Best Decision of the Geotechnical Problems in the Light of Multi-Valued Logic . Proc. NAFEMS World Congress 97 on Design, Simulation & Optimization Rel. & Appl. of Computer Methods, Stuttgart, April. Vol. 2; pp. 1279-1290;
Tran C. & Dembicki E. (1996) Optimization of the Block Foundations . 2 nd Conf. Of the Croation Society for Soil Mechanics and Foundation Engineering, Varażdin.
Dembicki E., Tran C. (1993) Quantification of subjective evaluation with the smallest residuals . Proc. of Comp. Math. In Mech., XI Polish Conf., Kielce-Cedzyna. Wyd. W. Gilewski, L. Chodor, Kielce, 1993; Vol. 1; pp. 244-252.
Dembicki E. & Tran C. (1993) Error minimization in environmental Risk Analysis . Proc. of the Int Conf., On Environmental Management, Geo-water and Engineering Aspects, Australia. Pub. A.A. Balkema pp. 681-686, ref. 5.
Tran C. & Dembicki E. (1991) Approximation Approach for Personal Estimation in Safety Analysis of Existing Structures . J. Int. Structural Safety v. 10, pp. 327-335.
Tran C. & Dembicki E. (1991) Deformation of Cantiliver Retaining Wall in Preconsolidated Anisotropic Clay . Procc. Of the 10 th European Conference SMFE, Florence
Dembicki E., Tran C. (1990), Bolt A. Optimization of a Block Foundation for Transmission Structures , Proc. of Int. Conf. Santander.
Dembicki E. & Tran C. (1989) Numerical Simulation of Fuzzy Soil-Structure Interaction . Proc. of Euromech colloquim 248 “Nonlinear Soil-Structure Interaction” Grenoble, France.
Dembicki E. & Tran C. (1989) System Analysis in Calculation of Cantilever Retaining Wall . Jnt. Jour. For Num. And Anal. Methods in Geotechnics. Vol. 13, John Wiley & Sons, Ltd. IF = 0.936
Dembicki E. & Tran C. (1989) Optimum Design of the Shape of Cantilever quay using a Decision-Making Process . of 3th International Symposium on Numerical Models in Geomechanics (NUMOG) Canada, 767-777.
Dembicki E. & Tran C. (1988) Multi-criteria Reliability-Based Structural Optimization Sym . On Reliability-Based Design in Civil Engineering, Lausane EPFL.
Tran C. (1987) Optymalizacja konstrukcji muru oporowego oparta na zasadzie optymalizacji wielo-kryterialnej . Rozprawa doktorska, Politechnika Gdańska, Wydział Hydrotechniki.
Dembicki E. & Tran C. (1986) Optymalizacja Kształtu Konstrukcji Muru Oporowego. Archiwum Hydrotechniki tom XXXIII, zeszyt 4, str. 463-475.
Dembicki E. & Tran C. Bolt A. (1985): Optymalizacja Geometrii Fundamentu Blokowego . Archiwum Hydrotechniki tom XXXI, zeszyt 1, str. 137-147; 6p. MNiSW
Dembicki E., Tran C., Sieradzki M. (1985): Application of Multi-objective Optimal Model in Foundation Engineering . Grenoble, France.
Srokosz P., Tran C. (2010) A distributed implementation of parallel genetic algorithm for slope stability evaluation ; Computer Assisted Mechanics and Engineering Sciences 11; Polish Academy of Sciences, 13-26; 6 p. MNiSW
Tran C., (2008) Damage detection of Structural Systems , Monograph, The Scientific research Problems of Building; Technical University Bialystok str. 133-138. 4 p. MniSW
Tran C. (2006) Smart Structure & Smart Computing Techniques . Proceeding of VIII Conference: The Scientific research Problems of Building; Olsztyn-Łańsk, Poland pp. 393-398.
Tran C. (2005). Single-nary philosophy for non-linear study of mechanics of materials , Proceeding of 18 th international conference on structural mechanics in reactor technology , Beijing, China. Editors Yu Zhou, Suyuan Yu, Yang Xu, 29.
Tran C. (2005) Truth – Non_additive Measures for Determination of Relative Density of Sands using CPT Measurements . R. Mecanique 330 Academie des sciences/Editions scientifiques et medicales Elsevier SAS, (lista Filad.), pp 605-611. IF = 0.799, 20 p. MNiSW
Tran C. (2004) Knowledge Based Optimization , Computer Assisted Mechanics and Engineering Sciences 11; Polish Academy of Sciences. 6 p. MNiSW
Tran C. (2004) Determination of Relative Density of Sands from CPT measurements based on fuzzy measure theory , Monograph, pub. Technical University Białostock, Poland pp. 233-242. 4 p. MNiSW
Tran C. Dembicki E, (2003). Shape optimization of the block foundation ; Proceeding of International Symp. On Shallow Foundation, FONDSUP Paris, France.
Tran C. (2002) Compromise solutions in Geotechnics based on high-order logic . Proceeding of Polish Conference Gdańsk, Poland.
Tran C. (2002) Optimization of cantilever quay based on fuzzy logic . Proceeding of International Symposium on Lightweight Structures in Civil Engineering, Warsaw, Poland.
Tran C. (2002) Optimization of Block Foundation in Truth Dimension . Proceeding of Workshop Optimal Design, Ecole Polytechnique Paris, France.
Tran C., Dembicki E., (2001) Geotechnical uncertainty in the light of high-order logic , Proc. of European Conference on Computational Mechanics, ECCM, Cracow, 1-19
Book: Tran C. (2021) “Potential Quantum Intelligence”, Lambert Academic Publishing in Germany 1-328 papers, ISBN-10 6204729969 (sach in), ISBN-13 978-620-4-79966-1 (ebook)
Book: Tran C. (2012) Dealing with Geotechnical Uncertainties by being-non-being philosophy and multi-valued logic ; Pub.. WM Universytet of Olsztyn, Poland.
Chapter of book: Tran C. (2008) Real-time Control for Mechatronic Systems ; Developments in Mechanical Engineering; v. 2, (Chapter 17); Technical University Gdańsk, Pland;
Tìm kiếm
ĐỊA CHỈ
Trường Quốc tế, Đại học Quốc gia Hà Nội
Cơ sở Xuân Thuỷ:
Nhà E5 & G7, 144 Xuân Thủy, Cầu Giấy, Hà Nội
Cơ sở Phan Tây Nhạc:
Số 1, Phố Phan Tây Nhạc, Xuân Phương, Hà Nội
Cơ sở Hoà Lạc:
Toà nhà HT1, Khu Đô thị đại học, Đại học Quốc gia Hà Nội tại Hoà Lạc, Hà Nội
Điện thoại: 024.3557.5992
Email: is@vnu.edu.vn
Bản đồ chỉ dẫn
Thông tin
Đại học Quốc gia Hà Nội
Các phòng chức năng
Các khoa trực thuộc
Các trung tâm, viện
Sơ đồ website
Xem sơ đồ trang
Liên hệ
Bản quyền © 2022 thuộc về Trường Quốc tế - ĐHQGHN
https://www.is.vnu.edu.vn"
https://www.is.vnu.edu.vn/bui-nhat-le/,ThS. Bùi Nhật LệTrường Quốc tế - ĐHQG Hà Nội,"Home » ThS. Bùi Nhật Lệ
ThS. Bùi Nhật Lệ
Chức vụ: Giảng viên tập sự
Học hàm, học vị: Thạc sĩ
Ngoại ngữ: Tiếng Anh
Email: lebn@vnuis.edu.vn
Địa chỉ: Trường Quốc tế – ĐHQGHN, Nhà G7, 144 Xuân Thủy, Cầu Giấy, Hà Nội
Dược sĩ: Trường Đại học Dược Hà Nội
Hướng nghiên cứu
Tế bào gốc trong điều trị, mỹ phẩm và dược phẩm
Y sinh học phân tử (miễn dịch học, di truyền y học và dịch tễ học phân tử)
Dinh dưỡng thực phẩm, sức khỏe cộng đồng
Sức khỏe môi trường
Các môn giảng dạy
Sinh học đại cương
Nhat-Le Bui , Hue Vu Thi, Mai Vu Ngoc Suong & Dinh-Toi Chu (2022) Mental Health Due to COVID-19 in Students in Vietnam: An Initial Assessment, Journal of Loss and Trauma, DOI: 10.1080/15325024.2022.2046675
Al-Tawfiq, J.A., Hoang, VT., Le Bui, N. et al. The Emergence of the Omicron (B.1.1.529) S ARS-CoV-2 Variant: What is the Impact on the Continued Pandemic?. J Epidemiol Glob Health (2022), DOI: 10.1007/s44197-022-00032-w
Dinh-Toi Chu, Hue Vu Thi, Yen Vy Nguyen Thi, Mai-Anh Nguyen, Nhat-Le Bui , Van Thuan Hoang, Do Hoang Nam, Duc-Lan Do, Van Thai than & Jaffar A. Al-Tawfiq (2022) Willingness to receive COVID-19 vaccine booster doses for adults and their children in Vietnam, Journal of Human Behavior in the Social Environment, DOI: 10.1080/10911359.2022.2046235
Tran, D. K., Phuong, T. N. T., Bui, N. L. , Singh, V., Looi, Q. H., Koh, B., … & Chu, D. T. (2021). Exploring the potential of stem cell-based therapy for aesthetic and plastic surgery. IEEE Reviews in Biomedical Engineering, DOI: 10.1109/RBME.2021.3134994
“Nutritional status and associated factors in children aged 15 – 17 years in a suburb in Vietnam”, – Journal of Advanced Biotechnology and Experimental Therapeutics, 2021, DOI: 10.5455/jabet.2021.d102
“ Nghiên cứu đường lây truyền của vi khuẩn Enterococcus faecium kháng vancomycin tại Khoa Hồi sức tích cực Bệnh viện Bệnh Nhiệt đới Trung ương”, tạp chí Y Dược học – NXB Bộ Y tế, vol 22, pp. 4-11, 2021
Cancer and lipid metabolism: roles of adipocytes on Tumor Microenvironment , Handbook of Cancer and Immunology – Springer
Nghiên cứu sự chấp nhận vaccine COVID-19 của người Việt Nam năm 2021. Đề tài Khoa Quốc Tế
Khảo sát tỉ lệ các loại phẫu thuật thẩm mỹ và các yếu tố ảnh hưởng đến quyết định phẫu thuật tại các phòng khám chuyên khoa thẩm mỹ trong năm 2018-2019
Willingness of Receiving COVID-19 Vaccines, Mental Health, and Prevention Measures Among University Students
10/2019 – 7/2021 : Cộng tác viên nghiên cứu tại Bộ môn Hóa sinh, Trường Đại học Dược Hà Nội và Phòng NCKH, Trường Đại học Y Hà Nội
3/2021 – 8/2021 : Cộng tác viên nghiên cứu tại Trung tâm Y sinh và Sức khỏe cộng đồng, Khoa Quốc tế, ĐHQGHN
9/2021-nay : Giảng viên tập sự tại Trường quốc tế, ĐHQGHN
Tìm kiếm
ĐỊA CHỈ
Trường Quốc tế, Đại học Quốc gia Hà Nội
Cơ sở Xuân Thuỷ:
Nhà E5 & G7, 144 Xuân Thủy, Cầu Giấy, Hà Nội
Cơ sở Phan Tây Nhạc:
Số 1, Phố Phan Tây Nhạc, Xuân Phương, Hà Nội
Cơ sở Hoà Lạc:
Toà nhà HT1, Khu Đô thị đại học, Đại học Quốc gia Hà Nội tại Hoà Lạc, Hà Nội
Điện thoại: 024.3557.5992
Email: is@vnu.edu.vn
Bản đồ chỉ dẫn
Thông tin
Đại học Quốc gia Hà Nội
Các phòng chức năng
Các khoa trực thuộc
Các trung tâm, viện
Sơ đồ website
Xem sơ đồ trang
Liên hệ
Bản quyền © 2022 thuộc về Trường Quốc tế - ĐHQGHN
https://www.is.vnu.edu.vn"
https://www.is.vnu.edu.vn/vu-thi-hue/,ThS. Vũ Thị HuệTrường Quốc tế - ĐHQG Hà Nội,"Home » ThS. Vũ Thị Huệ
ThS. Vũ Thị Huệ
Chức vụ: Giảng viên
Học hàm, học vị: Thạc sĩ
Ngoại ngữ: Tiếng Anh
Email: huevt@gmail.com , huevt@vnuis.edu.vn
Địa chỉ: Trường Quốc tế – ĐHQGHN, Nhà G7, 144 Xuân Thủy, Cầu Giấy, Hà Nội
Cử nhân: Y tế công cộng, Đại học Y Hà Nội
Thạc sĩ: Công nghệ sinh học, Đại học Khoa học Tự nhiên, ĐHQGHN
Hướng nghiên cứu
Tế bào gốc trong điều trị, mỹ phẩm và dược phẩm
Y sinh học phân tử (miễn dịch học, di truyền y học và dịch tễ học phân tử)
Dinh dưỡng thực phẩm, sức khỏe cộng đồng
Sức khỏe môi trường
Các môn giảng dạy
Sinh học đại cương
Phương pháp nghiên cứu khoa học
Phát triển bản thân và tính chuyên nghiệp
Current approaches in CRISPR-Cas9 mediated gene editing for biomedical and therapeutic applications. J Control Release 2022. DOI: 10.1016/j.jconrel.2022.02.005
Adipogenesis of ear mesenchymal stem cells (EMSCs): adipose biomarker-based assessment of genetic variation, adipocyte function, and brown/brite differentiation. Mol Cell Biochem 2022. DOI:10.1007/s11010-021-04350-8
Willingness to receive COVID-19 vaccine booster doses for adults and their children in Vietnam’, Journal of Human Behavior in the Social Environment 2022 : 1-13. DOI: 10.1080/10911359.2022.2046235
The mental health by Covid-19 in students in Vietnam: an initial assessment. Journal of Loss & Trauma 2022; 10(4).
Early Childhood Caries in Obese Children: The Status and Associated Factors in the Suburban Areas in Hanoi, Vietnam. Int J Environ Res Public Health 2021; 18 (16). DOI: 10.3390/ijerph18168844
Nutritional status and associated factors in children aged 15-17 years in a suburb in Vietnam. Journal of Advanced Biotechnology and Experimental Therapeutics 2021; 4 : 17. DOI: https://doi.org/10.5455/jabet.2021.d102
COVID-19 in Southeast Asia: current status and perspectives. Bioengineered 2022; 13 (2): 3797-809. DOI: 10.1080/21655979.2022.2031417
Cost-effectiveness of interventions for people with dementia without caregiver: A Systematic Review. Journal of Health and Development Studies 2021; 05 : 39-49.
Patient Safety Attitudes of Health Worker and its associated factors in Lung Hospital, Son La Province, 2020. Vietnam Journal of Preventive Medicine 2020; 30 (9): 105-14.
Già hóa chủ động của người cao tuổi tại hà nội năm 2018 và một số yếu tố liên quan. Tạp chí Nghiên cứu Y học. 2020
Paramyxoviridae (Paramyxovirus, Measles Virus, Mumps Virus, RSV), Reference Module in Biomedical Sciences (Elsevier)
Nghiên cứu một số đặc điểm lâm sàng, phi lâm sàng, dịch tễ và sự biến đổi, đột biến gene ở bệnh nhân ung thư buồng trứng. Đề tài cấp Đại học Quốc gia Hà Nội.
Willingness of Receiving COVID-19 Vaccines, Mental Health, and Prevention Measures Among University Students. SATU project. 2021
The demand status and associated factors to cosmetic surgery for eyes and nose – A cross-sectional study from Vietnam. Đề tài cơ sở
Nghiên cứu sự sẵn sàng tiêm phòng vắc xin COVID-19 và một số yếu tố liên quan ở Việt Nam năm 2021. Đề tài cơ sở Khoa Quốc tế.
08/2017-06/2021 : Cử nhân Y tế công cộng, Trường Đại học Y Hà Nội
09/2021-09/2022: Giảng viên (tập sự) tại Khoa Quốc tế, Đại học Quốc gia Hà Nội
09/2022-nay: Giảng viên tại Trường Quốc tế, Đại học Quốc gia Hà Nội
Tìm kiếm
ĐỊA CHỈ
Trường Quốc tế, Đại học Quốc gia Hà Nội
Cơ sở Xuân Thuỷ:
Nhà E5 & G7, 144 Xuân Thủy, Cầu Giấy, Hà Nội
Cơ sở Phan Tây Nhạc:
Số 1, Phố Phan Tây Nhạc, Xuân Phương, Hà Nội
Cơ sở Hoà Lạc:
Toà nhà HT1, Khu Đô thị đại học, Đại học Quốc gia Hà Nội tại Hoà Lạc, Hà Nội
Điện thoại: 024.3557.5992
Email: is@vnu.edu.vn
Bản đồ chỉ dẫn
Thông tin
Đại học Quốc gia Hà Nội
Các phòng chức năng
Các khoa trực thuộc
Các trung tâm, viện
Sơ đồ website
Xem sơ đồ trang
Liên hệ
Bản quyền © 2022 thuộc về Trường Quốc tế - ĐHQGHN
https://www.is.vnu.edu.vn"
https://www.is.vnu.edu.vn/vu-ngoc-suong-mai/,Vũ Ngọc Sương MaiTrường Quốc tế - ĐHQG Hà Nội,"Home » Vũ Ngọc Sương Mai
Vũ Ngọc Sương Mai
Chức vụ: Chuyên viên
Học hàm, học vị: Cử nhân
Ngoại ngữ: Tiếng Anh
Email: maivns@vnuis.edu.vn
Địa chỉ: Trường Quốc tế – ĐHQGHN, Nhà G7, 144 Xuân Thủy, Cầu Giấy, Hà Nội
Cử nhân: Hoá sinh, Juniata College, Hoa Kỳ
Hướng nghiên cứu
Tế bào gốc trong điều trị, mỹ phẩm và dược phẩm
Y sinh học phân tử (miễn dịch học, di truyền y học và dịch tễ học phân tử)
Dinh dưỡng thực phẩm, sức khỏe cộng đồng
Sức khỏe môi trường
Các môn giảng dạy
Sinh học đại cương
Chu D.T., Singh V., Vu Ngoc S.M . , Nguyen T.L., Barceló D. Transmission of SARS-CoV-2 infections and exposure in surfaces, points and wastewaters: A global one health perspective. Case Studies in Chemical and Environmental Engineering 2022; 5 .
Chu D.T., Bui N.L., Nguyen Thi Y.V., Vu Ngoc S.M . Covid-19 Drugs: A Necessary Strategy for Living with Covid-19 in the New Normal and the Mutations of the Sars-Cov-2 Such as Omicron Variant. Journal of Advanced Biotechnology and Experimental Therapeutics 2022; 5 (1) .
Chu D.T., Vu Ngoc S.M . , Vu Thi H., Nguyen Thi Y.V., Ho T.T., Hoang V.T., Al-Tawfig J. COVID-19 in Southeast Asia: current status and perspectives. Bioengineered 2022; 13 (2): 3797-809
Bui N.L., Vu Thi H, Vu Ngoc S.M. , Chu D.T. The mental health by Covid-19 in students in Vietnam: an initial assessment. Journal of Loss & Trauma 2022; 10 (4).
3/2021 – nay: Chuyên viên tại Trung tâm Y Sinh và Sức Khoẻ Cộng Đồng, Khoa Quốc Tế, Đại Học Quốc Gia, Hà Nội, Việt Nam
Nghiên cứu sự chấp nhận vaccine COVID-19 của người Việt Nam năm 2021. Đề tài Khoa Quốc Tế.
Willingness of Receiving COVID-19 Vaccines, Mental Health, and Prevention Measures Among University Students 2021. Đề tài SATU
Proportion of different aesthetic surgery and some related factors to the surgery decision: A study from Vietnam
Tìm kiếm
ĐỊA CHỈ
Trường Quốc tế, Đại học Quốc gia Hà Nội
Cơ sở Xuân Thuỷ:
Nhà E5 & G7, 144 Xuân Thủy, Cầu Giấy, Hà Nội
Cơ sở Phan Tây Nhạc:
Số 1, Phố Phan Tây Nhạc, Xuân Phương, Hà Nội
Cơ sở Hoà Lạc:
Toà nhà HT1, Khu Đô thị đại học, Đại học Quốc gia Hà Nội tại Hoà Lạc, Hà Nội
Điện thoại: 024.3557.5992
Email: is@vnu.edu.vn
Bản đồ chỉ dẫn
Thông tin
Đại học Quốc gia Hà Nội
Các phòng chức năng
Các khoa trực thuộc
Các trung tâm, viện
Sơ đồ website
Xem sơ đồ trang
Liên hệ
Bản quyền © 2022 thuộc về Trường Quốc tế - ĐHQGHN
https://www.is.vnu.edu.vn"
https://www.is.vnu.edu.vn/nguyen-thuc-quyen/,ThS. Nguyễn Thục QuyênTrường Quốc tế - ĐHQG Hà Nội,"Home » ThS. Nguyễn Thục Quyên
ThS. Nguyễn Thục Quyên
Chức vụ: Giảng viên
Học hàm/ Học vị: Thạc sĩ
Ngoại ngữ: Tiếng Anh
Email: quyentq @vnuis.edu.vn
Địa chỉ: Trường Quốc tế – ĐHQGHN, Nhà G7, 144 Xuân Thủy, Cầu Giấy, Hà Nội
Thạc sĩ : Xã hội học , ĐH Bang San Jose , Hoa Kỳ
Hướng nghiên cứu: Các yếu tố xã hội ảnh hưởng đến sức khoẻ
Các môn giảng dạy: Các học phần chung liên quan tới xã hội và sức khoẻ
Quá trình công tác
2020-11/2022: Cán bộ Dự án PHER-Đổi mới giác dục đại học.
04/2022-09/2025: Chuyên viên, Phòng KHCN&HTPT, Trường Quốc tế, Đại học Quốc gia Hà Nội.
09/2025-nay: Giảng viên- Nghiên cứu viên Khoa các Khoa học Ứng dụng
Tìm kiếm
ĐỊA CHỈ
Trường Quốc tế, Đại học Quốc gia Hà Nội
Cơ sở Xuân Thuỷ:
Nhà E5 & G7, 144 Xuân Thủy, Cầu Giấy, Hà Nội
Cơ sở Phan Tây Nhạc:
Số 1, Phố Phan Tây Nhạc, Xuân Phương, Hà Nội
Cơ sở Hoà Lạc:
Toà nhà HT1, Khu Đô thị đại học, Đại học Quốc gia Hà Nội tại Hoà Lạc, Hà Nội
Điện thoại: 024.3557.5992
Email: is@vnu.edu.vn
Bản đồ chỉ dẫn
Thông tin
Đại học Quốc gia Hà Nội
Các phòng chức năng
Các khoa trực thuộc
Các trung tâm, viện
Sơ đồ website
Xem sơ đồ trang
Liên hệ
Bản quyền © 2022 thuộc về Trường Quốc tế - ĐHQGHN
https://www.is.vnu.edu.vn"
